{
  "run_id": "DEMO-2",
  "feature_id": "DISCOUNT-01",
  "build_id": "demo-1",
  "timestamp": "2026-09-10T00:02:00Z",
  "tc_id": "TC-002",
  "result": "fail",
  "case_revision": "87066132dd647141c8c310cfb5a3e82e3bb87b965b81d196757461f789963fea",
  "model_hash": "318d0e7a17cc30958cdb52f863989d4320add284a852f027861a9f3b5041ce83"
}
